,name,description,longitude,latitude,category,country
143,"Krishna Mandir, Damaitole","Krishna Mandir, located in Damaitole, is a significant Hindu temple dedicated to Lord Krishna. Here are some key details about the temple:
Key Features
Historical Background:
Krishna Mandir is known for its historical significance and is part of the rich cultural heritage of the region. It is often associated with various festivals and rituals dedicated to Lord Krishna.
Architecture:
The temple features traditional Nepali architectural styles, showcasing intricate carvings and designs that reflect the artistry of local craftsmen.
Cultural Significance:
The temple plays an important role in the community, especially during festivals such as Krishna Janmashtami, when devotees gather to celebrate the birth of Lord Krishna.
Location:
Situated in Damaitole, this temple is accessible to both locals and visitors, making it a popular site for worship and cultural gatherings.
Community Engagement:
Krishna Mandir serves as a hub for religious activities and community events, fostering a sense of unity among worshippers.
Overall, Krishna Mandir in Damaitole is a vital part of the spiritual landscape in Kathmandu, reflecting the devotion of its followers and the rich traditions associated with Lord Krishna.",85.3048152476549,27.7067684210585, Religious Site,Nepal
144,Jagannath Mandir,"Jagannath Temple is the oldest structure in the Durbar Square area, claimed to have been constructed by Pratap Malla, but historical evidence suggests that it was built by Mahendra Malla, back in 1563. The two-storeyed temple is built on a three-tiered platform and is famous for the erotic carvings on its roof. Apart from its historical and religious importance, get ready to be surprised by the intricate carvings on the walls.",85.3195452690125,27.6702738360329, Religious Site,Nepal
145,Shree Kaal Bhairav Temple,"Kaal Bhairav is a significant Hindu shrine located in Kathmandu Durbar Square, a UNESCO World Heritage Site. This temple is dedicated to Kaal Bhairav, a fierce manifestation of Lord Shiva, and is known for its imposing 12-foot statue carved from a single block of stone.
Key Features
Historical Background:
The statue of Kaal Bhairav is believed to date back to the 5th or 6th century and was later placed in its current location by King Pratap Malla in the 17th century after being discovered in a paddy field.
Iconography:
Kaal Bhairav is depicted with six arms, stepping over a dead body while holding a decapitated head in one hand. This fierce representation symbolizes his role as the god of time and death, embodying both destruction and protection.
Cultural Significance:
The temple serves as a spiritual center for devotees who seek blessings for overcoming challenges such as diseases and enemies. It is also associated with justice; historically, it was believed that those who lied in front of Kaal Bhairav would face dire consequences.
Festivals:
The festival of Bhairav Ashtami or Bhairav Jayanti is celebrated with great enthusiasm at this site, attracting numerous devotees.
Location:
Kaal Bhairav is situated in the southwestern corner of Kathmandu Durbar Square, making it easily accessible for visitors exploring this historic area.
Overall, Kaal Bhairav stands as a powerful symbol of faith and justice in Hindu culture, drawing worshippers who revere him for his protective qualities and fierce nature.",85.3071242943406,27.7047757633846, Religious Site,Nepal
146,Bhimsensthan-Bhin: Dyo Temple,"Bhin Dyo Temple, also known as Bhimsen Temple, is located in the heart of Kathmandu, specifically in the area of Bhaktapur. Here are some key details about the temple:
Key Features
Deity:
The temple is dedicated to Bhimsen, a deity revered for his strength and protection, particularly by traders and merchants who seek his blessings for success in their business ventures.
Historical Significance:
The temple has deep historical roots and is associated with the life of Bhimsen Thapa, a prominent Prime Minister of Nepal during the early 19th century. His legacy is intertwined with the temple's importance in local culture.
Architecture:
Bhimsen Temple features traditional Nepali architecture, characterized by intricate wood carvings and detailed stonework that reflect the artistic heritage of the Malla period.
Cultural Importance:
The temple serves as a vital community hub where various religious activities and festivals are celebrated, fostering a sense of unity among local worshippers.
Location:
Situated in Bhaktapur, it is easily accessible for both locals and tourists exploring this historic area known for its rich cultural heritage.
Community Engagement:
Devotees frequently visit the temple to offer prayers and perform rituals, especially during festivals dedicated to Bhimsen, enhancing its significance in local culture.
Overall, Bhin Dyo Temple (Bhimsen Temple) stands as an important spiritual site in Kathmandu, reflecting the deep devotion of its followers and the rich traditions associated with Bhimsen in Nepali culture.",85.3042925521731,27.702588042784, Religious Site,Nepal
150,Kalikasthan Mandir,"Kalikasthan Temple is located in the Dillibazar area. This temple is dedicated to Goddess Kali and is an important site for local worshippers.
Key Features
Deity:
The temple is dedicated to Goddess Kali, a fierce and powerful form of the divine feminine, worshipped for strength and protection.
Cultural Significance:
Kalikasthan Temple is a vital spiritual center, especially during festivals like Dashain and Navratri, when many devotees visit to offer prayers and perform rituals.
Architecture:
The temple features traditional Nepali architectural elements, showcasing intricate designs that reflect the cultural heritage of the region.
Community Role:
It serves as a community hub where various religious activities take place, fostering a sense of unity among worshippers.
Accessibility:
Located in a central area of Kathmandu, Kalikasthan Temple is easily accessible by public transportation, making it convenient for both locals and tourists.
Overall, Kalikasthan Temple in Ward No. 29 is an important spiritual site that embodies the devotion of its followers and the rich traditions associated with Goddess Kali in Nepali culture.",85.3264821320772,27.7031520455069, Religious Site,Nepal
151,Ghanta Ghar Kathmandu,"Ghanta Ghar, also known as the Clock Tower, is a historic landmark located in Kathmandu, Nepal. Here are some key details about this significant structure:
Overview
Historical Significance:
Ghanta Ghar is the oldest clock tower in Nepal, built by Rana Prime Minister Bir Shumsher in 1934. It was designed to resemble Big Ben in London, reflecting the Western architectural influence during the Rana era.
Location:
The clock tower is situated in front of Rani Pokhari and near Trichandra College, making it a central point in Kathmandu.
Architecture:
The original structure was constructed using bricks and wood, featuring a distinct architectural style that blends traditional Nepali elements with European influences. After being damaged in the 1934 earthquake, it was rebuilt and has undergone various renovations since then.
Cultural Importance:
Ghanta Ghar serves not only as a timekeeper for the city but also as a symbol of modernization and historical significance in Kathmandu. It acts as a meeting point for locals and tourists alike.
Current Status:
The clock tower remains an important heritage site, attracting visitors who appreciate its historical value and architectural beauty. It continues to function as a public clock, although concerns have been raised about its maintenance and the skills required to keep it operational.
Conclusion
Ghanta Ghar stands as a testament to Kathmandu's rich history and cultural heritage, embodying the transition from the feudal era to modernity while serving as a beloved landmark for residents and visitors.",85.3169019520283,27.7075615557718, Historical Ruins,Nepal
152,Baneshwor Temple- ???????? ???????????,Baneshwor Mahadevsthan is a significant Hindu Temple located in the Baneshwor area of Kathmandu. This temple is dedicated to Lord Shiva amd is an important site for local devotees,85.3372672945261,27.6956651171549, Religious Site,Nepal
153,Babarmahal Palace,"Baber Mahal, also known as Baber Mahal Revisited, is a unique heritage complex located in the heart of Kathmandu, Nepal, near the Singha Durbar government offices. Originally built as a royal residence during the Rana period, the complex has been transformed into a vibrant commercial venue that combines history with modern amenities.
The site was developed in the late 19th century by Chandra Sekhar Jang Bahadur Rana and reflects the architectural style of the Rana era. It has been preserved and renovated to maintain its historical significance while adapting to contemporary uses.
Baber Mahal Revisited features a blend of shops, restaurants, and cultural spaces. The complex is known for its serene environment, offering a tranquil escape from the bustling city. Visitors can enjoy upscale dining options, artisanal shops, and art galleries within the beautifully restored buildings.
While it serves as a commercial hub, Baber Mahal also acts as a museum of Rana architecture, showcasing the rich cultural heritage of Nepal. It has become a popular destination for both locals and tourists seeking to experience Kathmandu's history in a modern context.
Overall, Baber Mahal stands as an important landmark that encapsulates Kathmandu's architectural beauty and cultural evolution.
",85.322533249855,27.6945866080535, Historical Ruins,Nepal
154,Kaiser Mahal Palace,"Kaiser Mahal is a historic Rana palace located in Kathmandu, Nepal, west of the Narayanhiti Palace. Originally built in 1895 for Kaiser Shamsher Jang Bahadur Rana, the palace complex features an impressive array of courtyards, gardens, and buildings, showcasing unique Edwardian architectural elements.
Historically significant, Kaiser Mahal has undergone various changes since the fall of the Rana regime. It was sold to the Government of Nepal and now houses the Kaiser Library and the Public Procurement Monitoring Office. The library, established by Kaiser Shamsher, contains around 28,000 volumes and serves as both a library and a small museum showcasing his extensive collection of books and artifacts.
The palace was partially damaged during the April 2015 earthquake but has since undergone retrofitting to preserve its historical architecture while enhancing safety standards. As of June 2024, it has been fully operational as a government office following extensive renovations.",85.314506739378,27.7146977278386, Historical Ruins,Nepal
155,Banbatika Park,"Banbatika Park is a famous park located in
Tilottama, Shankarnagar in the coordinate of
27.6527416and 83.4824252 in Rupendehi
district of Nepal. This batikais considered as a
ocal holidaying spot near BishwaSukh Shanti
Buddha Vihar. The park provides plenty of
items for the entertainment of children
including mini zoo, swings, sun, shade, flowers,
safe drinking water, and safe open space to run
around and play. Route no.1 microbus takes
you there from Golpark via TraffickChowk,
Milanchowk,Jogikutiin Shakarnagarchowk. The
park is considered as the local peaceful
tourism place and center for eco-
tourism.Banbatika park is a kind of forest park
and usually known for picnic spots and small
zoo for visitors and Research Centre.",83.482425045222,27.6527411924282, Scenic View,Nepal
156,Kankeshwor Mandir,"Kankeshwar Temple, also known as Kankeshwari Temple, is located in the Kalimati area of Kathmandu, Nepal. This temple is dedicated to Goddess Durga and is an important site for local Hindu worship.
The temple is approximately 185 years old and has become a significant cultural landmark in the region. It is associated with various local traditions and rituals, particularly during the Dashain festival, when devotees gather to honor the goddess.
Kankeshwar Temple features traditional Nepali architecture, characterized by its intricate carvings and a serene ambiance. Inside the temple, there are no statues; instead, it houses tantric stones representing Chamunda, a fierce incarnation of the goddess.
The temple gained recognition in 2016 when it became part of the UNESCO Heritage Walk, highlighting its importance alongside other historical sites in Kathmandu. It attracts many visitors, especially during festivals, serving as a center for community worship and cultural activities.
Overall, Kankeshwar Temple stands as a vital spiritual and cultural hub in Kalimati, reflecting the rich heritage of the local community.",85.3026909381151,27.7071679574544, Religious Site,Nepal
157,Nil Saraswati Mandir,"Neel Saraswati Temple, located in Lazimpat, Kathmandu, is a revered Hindu temple dedicated to Goddess Neel Saraswati, a form of the goddess Tara. This temple is particularly significant for students and scholars, as it is associated with knowledge and wisdom.
The temple is believed to have been established by Gunakamdev and has roots dating back to the end of the Malla period. The idol of Neel Saraswati has been worshipped by both Hindus and Buddhists, reflecting its cultural significance.
The temple features traditional Nepali architectural styles and includes idols of Saraswati depicted with harps, books, and garlands, symbolizing knowledge and learning.
Neel Saraswati Temple is especially popular during the festival of Basant Panchami (Saraswati Puja), when devotees gather to worship the goddess and seek blessings for academic success. The temple becomes a hub for students during this time.
The temple offers a serene environment conducive to meditation, attracting visitors looking for peace and spiritual reflection.
Situated in a central location in Kathmandu, the temple is easily accessible by public transport and is a popular destination for both locals and tourists.
Overall, Neel Saraswati Temple serves as an important spiritual center in Kathmandu, embodying the rich traditions of Hindu worship and the pursuit of knowledge.",85.3259483724833,27.7200247679584, Religious Site,Nepal
158,Sauraha Tharu Village ,"The village tour is famous for close and personal observation of the Tharu culture. Tourists like to take village tour to witness the daily lifestyle and activities of the Tharu community. The Tharu community reside along the entire length of the Terai plains of Nepal but Chitwan is especially popular for their traditional culture. There is a choice between foot or tonka ride for village tour. It is advisable to take the aid of a guide during the tour to better understand the local customs.

During tours you can experience the uniquely placed culture of the Tharu people relish what their culture is like in the Tharu Village Museum in the heart of Sauraha Bachhauli. For centuries, the Tharu have lived very closed to this protected area and hence their tradition reflects their intimate relationship with the natural world. Visit the Tharu village and share their world with them as you reach out to touch another culture.

To know more about the lifestyle and culture of Tharu people you can find books at the shops located at the Sauraha. You can tour the Tharu Village by yourself with the help of map or you can get the guide also for this and some hotels and travel agencies also arrange this service.",84.4937774352729,27.5875240110032, Tourist Attraction,Nepal
159,Ram Mandir Battisputali ,"Ram Mandir, located in Gaushala, Kathmandu, is a significant Hindu temple dedicated to Lord Rama. It is situated in a prominent area that is easily accessible for devotees and visitors.
Key Features of Ram Mandir, Gaushala
Cultural Significance:
The temple is an important site for Hindu worship, particularly during festivals such as Ram Navami, when many devotees gather to celebrate the birth of Lord Rama.
Architecture:
The temple features traditional Nepali architectural elements, showcasing intricate designs and craftsmanship that reflect the cultural heritage of the region.
Location:
Ram Mandir is conveniently located in Gaushala, a bustling area near Pashupatinath Temple, making it a popular stop for pilgrims visiting the nearby sacred sites.
Community Engagement:
The temple serves as a community hub where locals come together for religious activities, festivals, and social gatherings.
Accessibility:
Being situated in a central location within Kathmandu, Ram Mandir is easily reachable by public transportation and is within walking distance from other significant landmarks.
Overall, Ram Mandir in Gaushala plays a vital role in the spiritual landscape of Kathmandu, offering a place for worship and community interaction among devotees of Lord Rama.",85.3407652303576,27.7068206636422, Religious Site,Nepal
160,Kotilingeshwor Mahadev Mandir,"Kotilingeshwor Temple, also known as Kotilingeshwar Mahadev Temple, is a significant Hindu temple located in the Massangalli area of Kathmandu, Nepal. Here are some key details about the temple:
Key Features
Deity:
The temple is dedicated to Lord Shiva, specifically in his form as Kotilingeshwar. It is a revered site for devotees who seek blessings and spiritual fulfillment.
Architecture:
The temple features traditional Nepali architecture, with intricate carvings and designs that reflect the cultural heritage of the region.
Cultural Significance:
Kotilingeshwor Temple is an important pilgrimage site, especially during festivals such as Maha Shivaratri, when many devotees visit to offer prayers and perform rituals.
Location:
Situated in Massangalli, the temple is easily accessible for both locals and tourists, making it a popular destination for worship and cultural exploration.
Community Engagement:
The temple serves as a community hub where various religious activities and events take place, fostering a sense of unity among worshippers.
Overall, Kotilingeshwor Temple stands as an important spiritual site in Kathmandu, reflecting the deep devotion of its followers and the rich traditions associated with Lord Shiva in Nepali culture.",85.3072047606111,27.7051497790696, Religious Site,Nepal
161,Lumbini,"Lumbini is the Buddha s birthplace, located at Rupandehi, Nepal, is one of the world s most important spiritual sites and attracts Buddhist pilgrims from around the world. Today you can visit over twenty-five Buddhist monasteries built by diverse countries from Vietnam to France, study Buddhism, meditate and visit the birthplace within the sacred Mayadevi Gardens.
Mayadevi Temple is the most sacred site in the Lumbini Garden where archaeologists have identified the exact spot where Lord Buddha was born. Inscriptions on the Ashoka Pillar nearby also refer to the spot as his birthplace. It is said that the newly born Prince Siddhartha (later became the Buddha) took his first seven steps and delivered his peace message to humanity here.
The birth took place in the beautiful Sal grove, which is now the focal point of the Lumbini Garden. Mayadevi, the Queen of Shakya King Suddhodhana of Kapilvastu, while passing through the Lumbini Garden, on the day of Baishakha Purnima (full moon day of May in 623 BC) took a bath in the the Sacred Pond Pushkarini and soon after gave birth to Prince Siddhartha.


Visit the remarkably beautiful monasteries built by countries such as China, Japan, Sri Lanka, Myanmar, Germany, France and many more; admire the spectacular and diverse architecture they showcase. Soak up the peaceful atmosphere and above all, visit the Mayadevi Temple which dates back 2,200 years.
Walk around the garden or find a quiet spot to contemplate. The focal point for pilgrims is a sandstone carving depicting the birth of the Buddha, believed to have been left here by the Malla King Ripu Malla, in the 14th century, when Mayadevi was worshipped as an incarnation of a Hindu mother goddess. The Ashoka Pillar was built by the great Indian Emperor Ashoka who became a devout Buddhist while visiting the birthplace of the Buddha back in 249 BC.
Visit the Panditarama Vipassana Center for some yoga and meditation and interact with the monks who live in the vicinity of the monasteries, devoting their time to bringing peace and harmony to all sentient beings through devotion and religious worship.


The Lumbini Garden covers an area of 2.56 sq km and encompasses three zones each covering one square mile connected with walkways and a canal. The area has a sub-tropical climate with hot summers, very wet monsoon and pleasant winters. Winter is the best time to visit.",83.2756203599274,27.4693834941855, Tourist Attraction,Nepal
162,World Peace Pagoda,"The Lumbini World Peace Pagoda is located in the
north of the park. It was built by Japan and is 41
meters high. Need to go by bike. It was built with
donations from Japanese Buddhists. The shape is
somewhat similar to the Peace Pagoda in Pokhara.
The golden statue in the white pagoda depicts the
posture of the Buddha when he was born. There is a
cemetery near the base of the pagoda to
commemorate the killing by anti-Buddhists during
the construction of the pagoda. Japanese monk.",83.2762718014419,27.4989031628689, Monument,Nepal
163,Gorkha Durbar Palace ,"Gorkha Durbar, the Royal Palace of Nepal, is a magnificent and historic site that holds immense cultural and religious significance. Perched atop a hill overlooking the snow-capped peaks of the Himalayas, the palace was once the seat of power for the Shah Empire, who unified present-day Nepal.
The palace dates back to the mid-1600s, and its grounds are home to intricate Newari-style temples that share the origins of the Nepali national identity. Gorkha Durbar played a pivotal role in the unification of Nepal, serving as the strategic base for King Prithvi Narayan Shah and his successors as they consolidated dozens of principalities through diplomacy and conquest.
The palace's architecture is a fascinating blend of Newari and Mughal styles, with intricately carved timber frames, fired brick walls, and some stone facades. The central palace features elaborately painted columns, throne rooms, and personal apartments, while flanking faith structures honor clan deities with vaulted sanctums housing stones or sculptures.
Gorkha Durbar is not just a historical landmark; it is also a vibrant cultural and religious center. Major festivals like Dashain see the palace's courtyards packed with devotees, and the Goddess Kali temple holds annual blood sacrifices upholding longstanding covenants with the clan deity.
The palace's significance extends beyond its physical structures. It embodies the Nepali national identity and serves as a reminder of the country's rich history and proud heritage. Gorkha Durbar is a must-visit for anyone interested in learning more about Nepal's culture and history.",84.6287148445845,28.0043740763109, Historical Ruins,Nepal
164,Shanti Stupa,"The World peace pagoda or Shanti Stupa is the first one that was build. Located on top of the Ananda hill, one has to do a bit of trekking in order to reach the temple. The temple was built in Buddhist pagoda style and is painted in a brilliant white. The temple gives a whole view of the Annapurna mountain ranges, Pokara city and Phewa lake. The Shanti Stupa was built just after world war 2 to inspire peace for all races and creeds.",83.9447966404259,28.2010370212301, Monument,Nepal
165,Shree Bindhyabasini Temple,"Shree Bindhyabasini Temple, located in Pokhara, Nepal, is a revered Hindu shrine dedicated to Goddess Bindhyabasini. Perched on a hilltop, it offers panoramic views of the city and the Annapurna mountain range. Pilgrims flock to this sacred site to seek blessings and participate in religious ceremonies. The temple's rich history, cultural significance, and picturesque surroundings make it a must-visit destination for both devotees and tourists.

The temple comes with its own beauty which makes the temple a beautiful place for tourists.
Situated at a height of 3000 ft. above sea level and dedicated to Goddess Bhagawati, this is one of the oldest temple in pokhara valley.
 Situated on a hillock near busy old bazaar of pokhara, this wonderful religious landmark has immense natural beauty and is worshiped by Hindus and Buddhist alike.Worshipers flock to this place to perform animal sacrifice especially on saturdays. you can clearly observe beauty of Machhapuchhere/annapurna Himalyan range from this Temple.",83.9842031523585,28.237966730726, Religious Site,Nepal
166,Bhaktapur Durbar Square,"Bhaktapur Durbar Square"" the city is also known, is a museum of medieval art and architecture with many examples of sculpture, woodcarving and colossal pagoda temples consecrated to different gods and goddesses which is 15 km far from Kathmandu. It is a conglomeration of pagoda and shikhara-style temples grouped around a fifty-five window palace of brick and wood. The square is one of the most charming architectural showpieces of the Valley as it highlights the ancient arts of Nepal. The golden effigies of kings perched on the top of stone monoliths, the guardian deities looking out from their sanctuaries, the wood carvings in every place-struts, lintels, uprights, tympanums, gateways and windows-all seem to form a well-orchestrated symphony. Pottery and weaving are its major traditional industries.",85.4281021468341,27.6720740903371, Historical Ruins,Nepal
