,name,description,longitude,latitude,category,country
245, Sikali Mandir,"Sikali Temple lies in the southern part of Kathmandu Valley at an approximate distance of 10 KM. The temple is located in an isolated place, outside of the main settlements, but the surrounding is heavenly.

Sikali Mai Temple is a huge Three-storey temple, where goddess Rudrayani is worshipped and is considered as the protector of the locals and localities.

It is also believed that once Sikhi Buddha had come and taught Dhamma for locals.",85.2855021692812,27.6435353204397, Religious Site,Nepal
246,Manakamana Mandir,manakamana mandir,85.3005141578615,27.6196714469135, Religious Site,Nepal
247,Pakadi Tree,"The famous pakari plant in Devdah Municipality Ward No. 9 of Rupandehi District. This plant is called Pakad or Falaksha. Its scientific name is Ficus benjamina. This very beautiful and attractive pakari plant is also considered to be a buddhakalin plant. Because it is believed that Gautama Buddha also performed penance sitting under this tree. This pakari plant in the middle of the field has 7 levels. Its estimated circumference is 82 feet and height is 96 feet. Its branches spread all around, forming a circle of about 500 square feet. It is also the official tree of Bangkok. It is surrounded by walls on all sides for the protection of this tree. After entering from the entrance, this very wide tree is very amazing. Its branches are very thick and green leaves are visible from the roots. Surprisingly, its leaves are green throughout the year, the leaves never dry up. Crows, black kite and vultures never live in this pakari's bot. No nest of birds can be seen in this tree. Elephants will never go near this tree. If there is any kind of damage to this tree, it is considered unlucky, so no one dares to cut its branches. According to the locals, this plant is considered to be a tree for the Buddha, so local and foreign Buddhists come here and perform chanting, worship and recitation. Besides, there is a crowd of people who come to see this pakari tree every day. This tree is considered to be the biggest tree in Nepal, but this tree is also said to be the biggest tree in Asia. After this tree became famous, now the name of this place also remained Pakari. Koliya Nagar i.e. Devdaha is about 5 minutes away from Devdaha, the ancient place of mother and father-in-law of Gautama Buddha, and it is 2 km away from East-West highway located in Devdaha municipality.


REFERENCE: https://commons.wikimedia.org/wiki/File:Pakari_Tree_(Ficus_benjamina)_Buddha_Tree_Pakari_Devadaha_Rupendehi_District_Nepal_Rajesh_Dhungana_(12).jpg",83.5702169314027,27.6493107906057, Natural Landmark,Nepal
248,Rani Mahal,RANIMAHALPALPA,83.5278286412358,27.926397315492, Historical Ruins,Nepal
249,Resunga Yagyashala,RESUNGAYAGYASHALA,83.2695369422436,28.0646605456392, Religious Site,Nepal
250,Statue of Yalambar,"At the end of Nayabazar, there is a statue of Kirant King Yalambar along with Sakela Than. Yalambar, on a white horse with a long bow drawn, looks like he is about to go to war. Visitors to the market do not miss taking selfies here.",88.021216057241,26.9555088677804, Monument,Nepal
251,Ismakot,ISMAKOT,85.3092589974403,27.6837219567942, Natural Landmark,Nepal
252,Tilaurakot,"It was in the ancient city of Kapilavastu that Prince Siddhartha was raised from his birth until the age of 29. This was the capital of the ancient Sakya Kingdom, where the prince was treated to a lavish life of luxury   a way of life that he would ultimately reject to begin his spiritual journey.

When he was 29 years old, Prince Siddhartha left through the eastern gate of Kapilavastu, to start the path to enlightenment as Buddha. Today, you can stand in this exact same spot and look out through the gate, onto the green fields that saw the first steps of this epic journey. This moment has become an important part of modern spiritual journeys.

The remains of the ancient capital are in modern-day Tilaurakot and much of them have been excavated and restored, while archaeological work is still taking place to uncover even more parts of the city and insights into the life of Siddhartha Gautama.

As a major civic centre from about the 9th century BC until the 3rd century AD, there would once have been many grand buildings here. Already, experts have uncovered palace structures, temples, roads and ponds. Some of the artefacts that have been found during excavations are on display at the nearby Kapilavastu Museum.
Tilaurakot is also an important site for Hinduism and you ll notice a rustic modern Hindu temple dedicated to the deity Samai Mai within the ancient walls, where people regularly come to worship.
As you walk through the site at Tilaurakot, you ll get a sense of the scale of the city where Buddha grew up   but you ll also appreciate how isolated he was here, protected by his father. It s not hard to imagine how, as a young prince, he would have looked beyond the walls of Kapilavastu and felt there was something deeper that he needed to uncover.

REFERENCE :

https://commons.wikimedia.org/wiki/File:Pakari_Tree_(Ficus_benjamina)_Buddha_Tree_Pakari_Devadaha_Rupendehi_District_Nepal_Rajesh_Dhungana_(12).jpg",83.0468773841858,27.5517985365685, Archaeological Site,Nepal
253,Rishikesh Temple,RISHIKESHMANDIR,83.4372695535421,27.9345523079761, Religious Site,Nepal
254,Tumling,"Maijogmai Rural Municipality-2, Tumling of Ilam, is another important tourist area. From Tumling, visitors can see Kanchenjunga, Kumbhakarna, Makalu, Everest, and other mountains. People come here to watch the sunrise and sunset and to see the rare wild animal, the Red Panda.
Tumling is a favourite of wildlife experts and researchers as it is a red panda area and bird sanctuary. Butterflies of the Dhairi species are also found here. Dozens of species of rhododendron adorn Tumling like a bride. Anyone who comes to Tumling in March and April calls it the garden of flowers.
Most tourists coming here are from the Bengal region of India. The number of people coming for trekking from Mumbai, Delhi, and Hyderabad is also significant. Tumling is one of the top 10 tourist destinations in India. It snows here in winter, and in the rainy season, it feels like playing hide and seek among the thick fog.
After traveling about 15 km from Nayabazar, you reach Tumling. The Gurung community lives in this area at an altitude of 2,970 meters. Tumling is the residential area for hundreds of tourists who go on a trek to Sandakpur, the tourist area where the highest number of snow ranges can be seen.
Tumling is reached by a journey of about 10.5 kilometers from the Nepal-India border area Manebhanjyang and 29 kilometers from Fikkal Chowk in Ilam via Nayabazar and Jaubari. As it is also the head of the sacred Jogmai river, Tumling has religious significance. There is only a human settlement on the Nepalese side in the Tumling area, while the Sinhalela National Park is located on the Indian side. This area is always full of tourists.",88.0362129583955,26.9416616375978, Scenic View,Nepal
255,"Hill Park, Butwal",HILL PARK BUTWAL,83.4715223684907,27.6965818266696, Scenic View,Nepal
256,Meghma Monastry,"The monastery in Meghma is a famous religious tourist spot in Maijogmai-2. This monastery is equally important for Buddhists and researchers who go on a trek across the Nepal-India border. The seven-decade-old Buddha statue in the Sangchen Ngyur Hosal Dekshen Choling Monastery is considered one of the world's rarest. In the monastery, one can see an artistic presentation of different activities of human life, including scenes depicting sexual games, in 180 statues. That is why it is said that children should not see the idols here. These statues are symbols of peace and revolution.
Pujas are performed with great pomp on Buddha Purnima in the monastery. Western and Indian tourists visit this monastery, which is crowded with devotees during other Buddhist festivals as well. Although there were similar idols in Patala in Tibet and Japan, both were later destroyed. According to locals, this is the only remaining idol of its kind in the world.
Meghma, which is 40 km northeast of the Ilam headquarters, can be reached by a journey of about 10 km from the border at Manebhanjyang through the eastern pass Pashupatinagar. Similarly, Meghma can also be reached from Fikkal via Nayabazar and Jaubari. This area is also considered excellent in terms of biological and natural beauty, along with the views of Kanchenjunga, Kumbhakarna, and other snow-capped ranges.",88.0205696448684,26.9542539840924, Religious Site,Nepal
257,Nayabazar,"Established in 2011 B.S., the historical Nayabazar is the administrative centre of Maijogmai Rural Municipality. The municipality office is located here. Nayabazar has its own historical and cultural significance. Elders say this market was established by Balaguru. A big fair is held every year on the day of Balachaturdashi in Nayabazar. A statue of the endangered red panda in the centre of the market welcomes newcomers. Nayabazar, which is shrouded in fog most of the time, is a piece of heaven.
An idol of Sant Balaguru has been constructed near the market area. Balaguru Shivalaya Dham is also located here. The Shivalaya temple is known as the centre of Hindu religion, as Gurukul education teachings are conducted there.
A fair is organized at the temple on the day of Balachaturdashi. The movement of devotees and tourists from Nepal and India during the fair has helped to promote tourism. Since there is a tradition of sowing satbiu (virtuous seed) during the fair at Shivalaya Dham, there is a crowd of devotees from Nepal and India. Nayabazar has also introduced itself as a centre for buying and selling agricultural products such as cardamom and potatoes. Another attraction here is the Durga temple in the Nayabazar area.",88.0203356221318,26.9537805973319, Natural Landmark,Nepal
258,Malupokhari,"Malupokhari, of religious and touristic importance, is another attraction of Maijogmai. On the northeast side of the pond is the Sakela Than of the Rai caste. There is a Shiva temple on the south side. The pond and its surrounding areas, which are shrouded in thick fog, attract tourists.
Malupokhari protects the religious culture of different castes in one place. It takes half an hour on foot to reach this pond, which is 2 km southeast of Nayabazar, and there is a dirt road for transport.
The Malupokhari area, located in the midst of dense forest, has become a centre for domestic tourists. The Rural Municipality has been preparing a master plan for the construction of infrastructure in the Malupokhari area, which is also a water reservoir. Malu pond is also of great importance in the conservation of water resources.
A hall has been built for the devotees on the northeast side of the pond. Religious programs are organized here. To the north is the Sakela Than of the Kirant castes. In the Than area, 'Limchungbung', the flower of Kirant civilization, is found. There is a Shiva temple on the south side of the pond. A palanquin has been made for the devotees to sit inside the pool complex. To the north of the temple, there is an attractive stage, where programs of various religious castes are held.",88.0342978611588,26.9426865200401, Natural Landmark,Nepal
259,Balaguru Shivalaya Dham,"Balaguru Shivalaya Dham is located on a hill towards the southwest of Nayabazar. This temple, located in Maijogmai Rural Municipality-1, holds historical significance. Here stands an attractive three-storied temple dedicated to Shiva, which is open to devotees at any time, with regular puja performed daily.
Balaguru's idol is placed on the east side of the temple, and his tomb is in front of the temple. Experts say that Balaguru established Nayabazar around the year 2011 B.S. after clearing the dense forest. Around the year 2006, Balaguru came to this area and started living in a hut. In the Sanskrit Gurukul in this temple complex, students study Sanskrit language, literature, grammar, and rituals, and live in residential accommodations.",88.0202511325479,26.954494860683, Religious Site,Nepal
260,Mahadevasthan,"Mahadevasthan is another religious tourist spot in Maijogmai Rural Municipality. Mahadevasthan, which attracts domestic and foreign tourists, is located in Maijogmai-2. It is believed that visiting Mahadevasthan will fulfill your wishes. A fair is held here every year.
There is a cave inside Mahadevasthan, in the middle of a large rock. The Rural Municipality plans to study and research the cave and promote tourism. To reach Mahadevasthan, which is about 6 km from Nayabazar, you have to walk for an hour from there. You have to use a dirt road if you want to take a vehicle. Mahadevasthan is near Nayabazar, so you have to return to Nayabazar to stay overnight.",88.0357895046473,26.9431997049769, Religious Site,Nepal
261,Dha Tala Mandir,"Lying in the converging point of the Rudramati and Bagmati rivers in Jwagal lies the Dha: Tala Mandir. It is one of the sacred Nadhi Ghat Devsthal and is revered as one of the eight Asthamatrika. This shrine, established during the Shah dynasty, may be relatively new, but it carries an ancient spirit. The original statue of the shrine was stolen, and it was re-consecrated on the 16th of Ashar, 2051 B.S., restoring its sacred presence.

This beautiful pagoda-style shrine is dedicated to the deity Dhan Wantari Barahi of Dhalaut. Locals also refer to this temple simply as Dhan Wantari Barahi. Adorned with thirteen intricately carved tudals, the shrine is a feast for the eyes. The entrance gate is designed in the classical Newa Aakhi Jhyal style. It features stunning symbols of Surya, Ganesh, Chandra, Kumar, and Kalash, each carved with remarkable detail and care.

Guarded by two stone lions, the principal deity sits in serene majesty. The shrine also houses other revered figures like Laxmi, Shiva, Ganesha, Bhairav, Buddha, and Chitragupta, creating a heavenly gathering under one roof. Each idol stands as a testament to the rich tapestry of beliefs and the profound artistry that breathes life into stone.

The worship rituals here are a symphony of devotion. Worshippers offer akshata (rice), light diyas, incense, and flowers, creating a beautiful and serene atmosphere that envelops the senses. The rituals are simple yet profound, reflecting a deep connection to the divine. This shrine, with its Malla-style pagoda architecture, is not just a place of worship but a living gallery of devotion, history, and artistic beauty.

This shrine remains a beacon of spiritual peace. It invites all to experience its divine embrace and witness the sacred blend of faith and artistry. Whether you come seeking solace, inspiration, or a glimpse into a rich cultural heritage, the Dhan Wantari Barahi shrine stands ready to welcome you. 

Written/Compiled by: Apekshya Khanal


",85.3244106285274,27.6850374275395, Religious Site,Nepal
262,Tengboche Monastery ,"Tengboche Monastery (or Thyangboche Monastery), also known as Dawa Choling Gompa, in the Tengboche village in Khumjung in the Khumbu region of eastern Nepal is a Tibetan Buddhist monastery of the Sherpa community. Situated at 3,867 metres (12,687 ft), the monastery is the largest gompa in the Khumbu region of Nepal. It was built in 1916 by Lama Gulu with strong links to its mother monastery known as the Rongbuk Monastery in Tibet. In 1934, it was destroyed by an earthquake and was subsequently rebuilt. In 1989, it was destroyed for a second time by a fire and then rebuilt with the help of volunteers and international assistance.
Tengboche monastery is amidst the Sagarmatha National Park (a UNESCO World Heritage Site of ""outstanding universal value ), draped with a panoramic view of the Himalayan Mountains, including the well-known peaks of Tawache, Everest, Nuptse, Lhotse, Ama Dablam, and Thamserku.
Tengboche is the terminus site of the ""Sacred Sites Trail Project"" of the Sagarmatha National Park that attracts large number of tourists for trekking and mountaineering. It is a circular trail that covers 10 monasteries in a clockwise direction terminating in the Tengboche Monastery.",86.7634058743715,27.8362408034607, Religious Site,Nepal
263,Nritya Vatsala Temple,"The Vatsala temple built by King Jitamitra Malla was damaged in the year's earthquake and is now merely a red-floor temple, while the remaining two temples are still present. These three Vatsaladevi temples are known as ""Yantra Vatsala,""
""Kalash Vatsala,"" and ""Dance Vatsala,"" respectively. Vatsaladevi assumed the guise of MATA DURGA (PARBATI) in order to unite women and Lord Yaksheshwar (Pashupatinath of Bhaktapur). The strength of the goddess inside a temple can be determined by looking at the temple's form. This temple's second floor includes four directions, eight miniature temples on each corner, and nine temples in the center. Indrayani is in the North, Barahi is in the West, Bhadrakali is in the South, and Mahakali is in the East, with a Mahakali statue in the east and Khetrapal Bhairav at the four corners. It is apparent from this that this temple houses a great deity.",85.4284204915166,27.6716108236425, Religious Site,Nepal
264,Manakamana Temple,"The Manakamana Temple is a holy Hindu site in Nepal's Gorkha district. The temple is on top of a hill and looks out over the valley of the Trishuli River and the beautiful Himalayas in the distance. The name of the temple comes from two words: ""Mana,"" which means ""heart,"" and ""Kamana,"" which means ""wish."" The temple is dedicated to the Goddess Manakamana, who is thought to be an incarnation of the Goddess Bhagwati. So, many people call Manakamana the ""Goddess of the Heart's Wishes.""

Pilgrims from all over Nepal and nearby countries come to this temple because they are sure that Goddess Manakamana will help them get what they want if they make the trip to ask for her blessings. In the past, the trip meant a hard climb up the hill. But since the Manakamana Cable Car was built, the journey has become easier, bringing in even more tourists and religious people.

The building is very important to history and culture. The story that goes with it is about a queen who was thought to have divine powers but died in a sad way. Later, a farmer is said to have found the spot where the queen was honored as a goddess, which led to the building of the temple.

Today, the Manakamana Temple is not only a place of worship, but also a symbol of Nepal's rich cultural history and spiritual customs.For Hindus, Muktinath Temple is one of the 108 Divya Desams or holy abodes of Lord Vishnu, the god of preservation. It is believed that a pilgrimage to this sacred site can help to break the cycle of birth and death (samsara), granting salvation (moksha) to the devotees. In addition, Muktinath is one of the eight most sacred shrines in the Hindu tradition, known as the Swayam Vyakta Kshetras, where Lord Vishnu is said to have manifested himself. Devotees visiting the temple often take a ritual bath in the 108 sacred water spouts, known as Mukti Dhara, and the two holy ponds, Mukti Kunda and Saraswati Kunda, to cleanse themselves of sins and achieve spiritual purification.For Hindus, Muktinath Temple is one of the 108 Divya Desams or holy abodes of Lord Vishnu, the god of preservation. It is believed that a pilgrimage to this sacred site can help to break the cycle of birth and death (samsara), granting salvation (moksha) to the devotees. In addition, Muktinath is one of the eight most sacred shrines in the Hindu tradition, known as the Swayam Vyakta Kshetras, where Lord Vishnu is said to have manifested himself. Devotees visiting the temple often take a ritual bath in the 108 sacred water spouts, known as Mukti Dhara, and the two holy ponds, Mukti Kunda and Saraswati Kunda, to cleanse themselves of sins and achieve spiritual purification.",84.5840337686241,27.9042139191128, Religious Site,Nepal
265,Pangboche Monastery ,"Pangboche, a hidden gem nestled in the lap of the Himalayas. This picturesque village, located in the Solukhumbu District of Nepal, offers a truly extraordinary experience for those seeking adventure, tranquility, and cultural immersion. Prepare to be enchanted as we unravel the captivating wonders of Pangboche and its surrounding treasures. From sacred monasteries to stunning landscapes, this extraordinary destination has it all.
Pangboche is renowned for its ancient and historically significant monastery, Pangboche Gompa. Believed to have been founded in the 17th century, it is one of the oldest Sherpa monasteries in the Khumbu region. The monastery holds religious ceremonies, rituals, and festivals that offer a glimpse into the spiritual practices and beliefs of the Sherpa community. Its architectural style and intricate artwork reflect the rich cultural heritage of the region. The monastery houses ancient artifacts, sacred religious texts, and intricate wall paintings. It is also known for its ""Yeti Scalp"" relic, which is claimed to be the scalp of a mythical Yeti creature.",86.7882672697306,27.8570946783985, Religious Site,Nepal
266,Nepal Folk Musical Instrument Museum,"The founder of the museum, Kadel is not a musician himself but a genuine admirer of the musical traditions. His dedication to his passion has driven him to keep up with his collection and sustain the cultural heritage. The museum now showcases 655 distinct Nepali folk musical instruments among more than 1350 from all over the country. The impressive fact about this museum is that all the musical instruments are either bought or newly made by the local artisans. No instrument is taken from any place where artists still play them. Only those, which are not in use are brought and kept in the museum. That way, the local artists can continue playing live music, keeping up the vibrance of the melodies. 
Folk music is not much in practice these days, which makes it a priority to save them. If it is forgotten, it is not just the music that we lose; we lose our culture, we lose our history. The folk musical instruments are simple, made from whatever is found from the surrounding. Inspired by the sound of nature: the waterfalls, blowing of the wind, mooning of cattle, chirping of birds, even the shape of the instruments is influenced by the nature. The Hiti Manga, for instance, is a fine replica of the water spouts in Kathmandu, producing music similar to the sound of water filled in a pot from the spout. 
",85.3144537657499,27.6923466406901, Art Gallery,Nepal
267,Kopan Monastery,"Kopan Monastery, nestled near Boudhanath on the outskirts of Kathmandu, Nepal, is a haven for Tibetan Buddhist study and practice. Founded in 1969 by Lama Thubten Yeshe and Lama Thubten Zopa Rinpoche, Kopan has garnered international acclaim for its dedication to teaching Buddhism to Westerners.
More than just a monastery, Kopan has blossomed into a complex encompassing two distinct institutions: the Kopan Monastery atop Kopan Hill and the nearby Khachoe Ghakyil Ling Nunnery, established in 1979 to empower women with spiritual and practical education modelled after the monks' program. The nunnery's remarkable growth, from 4 nuns to 400 in under 35 years, is a testament to its dedication and the generosity of supporters who utilize platforms like GoFundMe to fuel its expansion.
Beyond its educational pursuits, Kopan Monastery has become a vibrant community hub, welcoming hundreds of visitors every Saturday from 10 AM to 4 PM. While closed to the public on weekdays, these designated hours offer Kathmandu residents and tourists alike a chance to immerse themselves in the monastery's serene atmosphere, participate in guided meditations, and soak in the wisdom dispensed by resident monks and teachers. Kopan Monastery stands as a beacon of Buddhist scholarship and spiritual practice, attracting both dedicated students and curious travelers seeking a glimpse into the rich tapestry of Tibetan Buddhist culture.
",85.3649134933949,27.7423388461752, Religious Site,Nepal
