,name,description,longitude,latitude,category,country
68,Naxal Bhagawati Temple,"Naxal Bhagwati or Simwahini Bhagwati temple in Bhagwati Bahal of Naxal in Kathmandu district. This temple is considered to be a Lichhavi temple. Inside the temple, there is a magnificent and attractive idol of the goddess with eight arms carved on a black smooth stone. According to the Devmala genealogy, when King Bikram Keshari ruled the kingdom from Navsagar Maharani in ancient times, Kaligadh, the incarnation of Vishwakarma, made an idol and offered it to the Maharani. It is also mentioned that King Shankardev made a statue and set it up in 664 BCE and put it in a pit and filled it with stones. In the time of Licchavi king Grihapati Manadev, a skilled artist first made a statue of Palanchok Bhagwati and installed it there. However, it is said that the same artist made his second octagonal idol of Bhagwati, i.e. Naxal Bhagwati, with his left hand. He then cut off the left finger of this skilled artist, but he did not allow his artistry to diminish. Even after that, there is a legend that the same artist made a statue of Shobhabhagwati with his toes no matter how daring he was in his art. Thus, the artist who built these three temples is the same. According to the red seal records of 1838 BS, it is believed to have been built before the 16th century. The temple was renovated during the reign of Shri 3 Juddhashamsher after it collapsed in the great earthquake of 1990 BS. A fair is held here on the day of Vampire Chaturdashi. Bhairavi, Tundal Devi and Naxal Bhagwati of Nuwakot are the three sisters. It is also one of the various Shakti Piths in Nepal. In this temple complex, there are Shiva's temple, Hanuman's temple, artistic stone stream, Shiva lidg, Budhanilkantha, small stupa, and various idols of gods on the walls. This temple is full of woodwork and other arts. In this temple, there is always a crowd of devotees, but on the great festival of Nepalis, Vijayadashami, this Naxal Bhagwati is very important and attracts a lot of devotees. This temple is highly regarded by Hindus.",85.3288091160357,27.7126950572653, Religious Site,Nepal
69,Chamunda Mandir,"Located at lalipur, three storey Chamunda Temple is said to be dated at 3rd century AD. Everything indicates that this is a very ancient site in the valley.
Moreover, Shankhamul is one of the twelve ""most- sacred"" confluences in the Kathmandu valley as defined in the numerous chronicles that document the history and legends about the Kathmandu valley. The spaces where two or three rivers flow into each other across Nepal are all sacred sites. At Shankhamul, the Bagmati River that flows south from the Pashupati temple complex, and all the rivers that flow from the eastern part of the valley including the Manohara River merge. The river then continues its journey west, south and then out of the Kathmandu valley at Chobhar and then on to the Terai",85.3292097710073,27.6787430979912, Religious Site,Nepal
71,Hyagrib Bhairab Mandir,"The temple of this deity is situated at Machhindra baha in Bungamati, Lalitpur. It is said to have been built by king Siddhi Narsingh Malla in the 16th century. This form is locally also known as Rundakunda. And the face of this deity can also be seen in the chariot of the Rato Machhindranth.
Hayagriva Bhairav: Hayagriva belongs to set of four Buddhist Bhairavas. Buddhist consider Bhairava as the protective and fierce deity who wears a scalp of a horse on his head and carries chains and fetters. The Buddhist idealism treats Bhairava as the ferocious horizon echoing with the vibration of Mind. In Tibet, Hayagriva is considered as the wrathful aspect of Avalokitesvara. In Hindu iconography Hayagriva is a horse-headed form of Lord Vishnu.
At the north-eastern corner of the Macchendra baha is the recently reconstructed Hayagriva Bhairava temple. The temple was destroyed in the 2005 AD earthquake. Though Hayagriva in Sanskrit means horse-necked deity, the image does not resonate any significance of it. Some historians believe that the temple was previously imageless, only a boulder was consecrated as a the sacred image.
A huge metallic image of Bhairava was placed in 1660 AD. This Bhairava is locally also known as Runda-kunda. An elaborate worshipping of the Bhairava of this temple takes place during the annual Manakamana Jatra.",85.3020829148591,27.6293820918407, Religious Site,Nepal
72,Sapta Patal Pokhari,"Sapta Patal Pokhari, located in Lalitpur district of Nepal, is a scenic and sacred site consisting of seven interconnected ponds, or ""pokharis,"" situated at the base of the Himalayas.apta Patal Pokhari is nestled in the hills of Lalitpur district, approximately 18 kilometers southwest of the Kathmandu Valley. 

The name ""Sapta Patal Pokhari"" translates to ""Seven Layered Ponds"" in English. According to local beliefs and Hindu mythology, these seven ponds are considered sacred and have religious significance. Devotees often visit the site for spiritual retreats, meditation, and religious rituals.In addition to its natural beauty and religious importance, Sapta Patal Pokhari holds cultural significance as a heritage site in Lalitpur district. It is a place where local traditions and customs are celebrated, and where visitors can experience the rich cultural heritage of the region.",85.3230718709528,27.6664652520674, Natural Landmark,Nepal
73,Agnishala,"Agnishala temple, a 4000 years old temple located at Patan in Kathmandu valley is famous for its religious importance in the Hindu religion. The temple is visited by the worshippers who want to set their anticipated misfortune arising from unfavorable Graha Dasha (Planetary Configuration). There are five kundas (Fire altars) inside the premises of the temple: Vishnu Kunda, Brahma Kunda, Shiva Kunda, Surya Kunda, and Savya Kunda. It is believed that a fire has been kept burning continuously (Eternal) for many years in the Vishnu kunda. Devotees perform hom (Religious ritual performed for happiness and well-being) in the holy fire of Vishnu kunda. The temple is considered as the most important shrines in Kathmandu Valley. During the festival of   Maghe Sankranti ( A festival to welcome spring), you can find a large number of crowd worshipping the Kundas and the holy fire. Buddha Jayani, the first of Kartik is considered as the anniversary date of the temple according to the holy priest. Hindu devotees from all around the world visit this temple at least once in their lifetime. We would recommend you to visit this religious temple if you are near the Kathmandu valley.",85.3213317878544,27.672591214916, Religious Site,Nepal
74,Uperdangadi Chitwan,"Uperdangadi was Chitwan district's old headquarter. Uperdangadi a historical
place located in Ichchhakamana Rural Municipality , ward no.7 in Mahabharat
Parbhat range is at 1275 metres height from the sea level. This historical place
was built by the Sen king for military accommodation during medieval period.
Later on Prithvi Narayan Shah's grandson, Bahadur Shah's son, Satrubhanjan Shah
reconstructed Uperdangadi. Uperdangadi covers 639 square metres area and
there are royal palace, historical court, remainings of police and military
accomodation, Cannon at the four walls, Lord Shiva and Kalika temple at the
south, Lord Ganesh idol at the north and Bajrayogini and Balkumari temple inside
gadi. Uperdangadi is constructed from stones and limestones. We can view
Chitwan national park, Narayani river and rapti river from Uperdangadi. We can
even see tourist birds in this region .
",84.6218230761588,27.8627225709591, Natural Landmark,Nepal
75,Machchhindranath Ko Aama,"Machchhindranath ko Aama, also known as Yogambar, is a unique shrine near the bustling Lagankhel bus stop. Encircled by a white wall, it s easy to find, and holds deep significance for Buddhists who honor the temple's Mandap as ""Yogambar.""

While historical records are scarce, the shrine is tied to King Narendra Dev and houses a statue of Nag Raj. It's a focal point for local Tantric practices, where many esoteric rituals unfold. Known as a  Yoni  temple in Tantric tradition, it shelters around twelve gods and goddesses. A special goddess, plastered within the wall, is worshipped as Yogambar, and directly opposite, a shrine represents ""Machchhindranath ko Aama.""

Folklore and myths surround the temple s origins. One story tells of Rato Machchhindranath s mother weeping as her son was taken to Nepal Mandap or Kathmandu. The caretakers of Hiranyabarna Mahabihar comforted her, promising that Machchhindranath s journey was for the greater good of Nepal Mandap. In memory of this tale of maternal care and the deity s journey, these deities are revered. The Rato Machchhindranath Jatra is one of the festivals that celebrates their enduring legacy and devotion.

Written/Compiled by: Apekshya Khanal 

References: 
Book published by Lalitpur Ward No. 12

",85.3244351036847,27.6710883728065, Religious Site,Nepal
76,Doleshwar Mahadev Temple,"The Doleshwar temple is constructed in pagoda style. The temple is also known as Bimaleshwor and Sipare Mahadev and other names as per the local tongue and tradition. Inside the temple, there is a huge plain Shiva Linga (phallus). There are taps, a big idol of bull, a tall Trishul and other artifacts around with some constructions still underway.

Visiting this Shiva temple and offering milk and bel leaves to Lord Shiva is an important ritual for the Hindus or Lord Shiva devotees. The place which was unknown for thousands of years can be now called as a hidden gem. With the grace of Lord Shiva, it is an immense opportunity for the devotees to visit this sacred site and be blessed for the life time.

When you plan to visit Doleshwar, you can also visit other Shiva shrines like Ashapuri Mahadev Temple and Sanga, which are only few kilometers away. Sanga consists of Kailashnath Mahadev which is the world s tallest statue to Lord Shiva, standing 44 meters tall on a high hill. It can be an ideal day trip to visit all these shrines on a single day which can provide you an inner peace and evoke faith on god.

Doleshwar Mahadev is a temple of glory to all Hindu devotees around the world, and one must visit here to gain the ultimate religious experience, as some claim, the great opportunity to worship both the body and the head part of Lord Shiva is obtained only by the virtue acquired from multiple births.",85.43840887025,27.6388663074807, Religious Site,Nepal
77,Jai Manohar Mahabihar,"Jai Manohar Mahabihar is renowned for its striking pagoda-style architecture and intricate woodcarvings, typical of traditional Newari craftsmanship. The monastery is dedicated to Manjushree, a bodhisattva associated with wisdom in Buddhism. It holds religious and cultural importance for Buddhists in the Kathmandu Valley and beyond.

Visitors to Jai Manohar Mahabihar can explore its courtyards, prayer halls, and shrines, experiencing the serene ambiance and admiring the intricate details of the architecture. The monastery also hosts various religious ceremonies and festivals throughout the year, attracting both local devotees and tourists interested in Buddhist culture and spirituality.",85.3302233107388,27.6707799351174, Archaeological Site,Nepal
78,Mani Mandap Mahabihar,"The Mani Mandap Mahabihar, also known as Mani mandap Mahabihar, is a historic Buddhist monastery located in Lalitpur, Nepal. This ancient structure holds significant religious and cultural importance and is considered one of the most important sites of Buddhist heritage in the region.

Built in the 17th century during the Malla period, the Mani Mandap Mahabihar is renowned for its exquisite Newari architecture and intricate woodcarvings. The monastery follows the traditional pagoda-style architecture typical of the Kathmandu Valley, with multiple tiers, intricately carved eaves, and ornate embellishments.",85.3241621889174,27.674595495425, Archaeological Site,Nepal
79,Bikram Baba Temple,"Originally revered solely by the Tharu community, the Bikram Baba Temple has evolved into a prominent pilgrimage site for devotees of various faiths. Located by the Rapti River near Jagatpur, this revered temple is known for fulfilling the desires of childless couples. 

Approximately 10-15 years ago, a local discovered a stone resembling Bikram Baba at the base of a tree. In Hindu mythology, Bikram Baba symbolizes a brave guardian. Since then, the site has attracted people from other backgrounds seeking to fulfill their wishes. Access to this sacred place is limited to a specific festival, celebrated over 10-15 days, drawing visitors from across Nepal for worship.",84.3385968916118,27.5506940033359, Religious Site,Nepal
80,Lumbini Museum,"Located at the entrance of the Sacred Garden Area of Lumbini, the Birthplace of the Historical Buddha and a UNESCO World Heritage Property, the Lumbini Museum will be a true gem when it launches in early 2022. As the world s only contemporary museum of the Buddha and his Birthplace, the Museum will be the anchor that sets the stage and enhances a visitor s experience of Nepal s most sacred site. What happened here, some 2,600 years ago, shifted the consciousness of millions, and continues to resound with a universal clarity that impacts people in the most fundamental aspects of their life.",83.2772219739854,27.4891662676647, Art Gallery,Nepal
81,Tal Barahi Temple,"The temple of Tal Barahi or Tal Barahi is located in Kaski district and is known popularly as the lake temple. Dedicated to goddess Durga, this temple stands alone in a small island in a section of Phewa Lake. While there are many stories associated with the temple, the most popular one among the people are that king Kulmandan Shah who was the first king of Kaski had a dream in which he saw the temple above the lake and the goddess asking him to construct it. He followed the instructions and build the temple.Tal Barahi Temple is a
small 2 story pagoda-
style temple devoted to the deity Tal Barahi.This Hindu temple in
nepal dedicated to Ajima in the boar manifestation, represation of the force of Shakti. Shakti is the Hindu mother goddess who is the origin of the univese creativity
and power. Shakti as a feminine power assumens several roles. In the form of Durga, Shakti protects the gogs from demons. Durga takes on the manifestation of Ajima in the form of a boar called
Barahi to pirece her evil enemies with her pointed tusks. Barahi is pictureds with the face of boar with a cup in one hand and
fish in other hand. As such, Barahi Temple is a very important center of worship for the Hindu devotees. Tourists are likely to see worshipers making their way to the temple on saturdays carrying
way to the temple on saturdays carrying animals fir sacrifice.The original structure of the temple is made of stone and has a thadched roof. The dramatic beauty of its location it self
attracts everyone. As the Temple is on a small island in fewa lake, the only way to visit it is by boat. tal barahi is one of the most famous pilgrimage sites in Nepal and countless Hindus come to worship the deity.The legend, has it that many years ago a deity named Barahi came here to see the local People here but later decided to live here permanently.The temple located in the heart the Pokhara
valley at lakeside and is easy to get to from any part of Pokhara. Talbarahi temple sits
on a small mound surrounded by the crystal-clear waters of fewa Lake. The only way of getting to the temple is by boat. Phewa Lake is the second biggest in
Nepal. It size measures in at 4 km by 1.5 km. The lake itself is a major attraction drawing those who enjoy water sports, families and those who simply love absorbing the beautiful scenery. The warm
waters are inviting and ideal for a trip on a little wooden boat, which can be rented along the shoreline. Along the Lakeside section of Phewa, visitors can explore the
various souvenir stores, bookshops and restaurants. Simply hop aboard a boat and
float out to the island in the center, to discover even more treasures.",83.9535466767848,28.2074622738746, Religious Site,Nepal
82,Elephant Breeding Center,"Elephant Breeding Center, offers a fascinating glimpse into the graceful world of elephants. During your visit, you ll witness the meticulous preparation of elephant meals and gain insights into the nature and habits of these majestic creatures. Established in 1985, this unique center aims to facilitate the captive breeding of domesticated elephants, contributing to their conservation.
Situated in Sauraha, the Elephant Breeding Center serves as a haven for endangered elephants in the region, often housing adorable baby elephants and featuring a quaint museum. The center is approximately an hour s walk from Sauraha, the duration depending on weather conditions and heat. Alternatively, tours or rickshaw transport can be arranged for part of the journey.
Entrance fees are 100 rupees for foreigners, 50 for SAARC visitors, and 25 for Nepalese citizens. Operating hours extend from 6 am to 6 pm, though it s advisable to arrive before 5 pm to ensure sufficient time for exploration, as the center typically begins closing procedures around that hour.",84.4630554132164,27.5819441573633, Tourist Attraction,Nepal
83,Mani Chaitya,Mani Chaitya.,85.3254949115217,27.6735672922456, Religious Site,Nepal
84,kusunti Kumar Mandir,kusunti kumar mandir.,85.3120350837708,27.6645393316254, Religious Site,Nepal
85,Dattanam Mahabihar,Dattanam Mahabihar.,85.323233474046,27.6741528232498, Archaeological Site,Nepal
87,Ashok Stupa Ibahi,This Stupa is comparatively more complex and smaller than the other three Stupas. This is similar to the structure of Svayambhu Mahacaitya in Kathmandu. It is nearly circular and has a perimeter of 60.62 meters. It has five Buddha in the Vedika with their consorts except the Tathagata Vairocana. It has a Vedika of 1.5 meters and a dome of 5.5 meters in height. A square Harmika is constructed over the dome with 13 steps Cakravali and a parasol.,85.3276879526675,27.6770758943224, Archaeological Site,Nepal
88,Patan Museum,"Patan Museum is housed in a courtyard within the Northernmost building complex of the Durbar area. The most picturesque setting of the palace that has been created in so small a place by piety and pride  is known now to the people as Keshav Narayan Chowk after a temple standing at the center of the courtyard dedicated to Keshavnarayan- a form of Lord Vishnu.This part is recorded in the history as Chaukot Durbar or four-cornered-fort-palace.In an International Campaign by UNESCO for safeguarding the monuments of Kathmandu valley, the Austrian Government joined hands with Nepal Government to preserve Patan Darbar Square. The ensuing project began in 1982 with the repair of Keshav Narayan Chowk that led finally to the transformation of a teaching museum to dessimination of knowldge on Buddhism prevailed in Patan- city of Art and Architecture.This is the first public museum in Nepal that has been created as an autonomous institution of this type managed by its own Board of Directors. The museum has been acclaimed, by the visitors, as one of the finest museums in South Asia. The popularity is growing day after day and is economically self sustained now.The collaborative effort of Austrian Government with Nepalese counterpart did not only restore the historical palace to its original grandeuer but also created a Model Cultural Institution in Nepal.",85.3256650641561,27.6725289227947, Art Gallery,Nepal
89,Bhai Dega ,"Bhai Dega Temple, also known as Bhairabsthan or Bhai Dega Bahi, is a historic Hindu temple located in Lalitpur, Nepal. Situated in the heart of the city, this ancient temple holds significant religious and cultural importance for the local community.

The temple is dedicated to Lord Bhairab, a fierce manifestation of Lord Shiva, who is worshipped as the god of destruction and transformation in Hindu mythology. Lord Bhairab is often depicted with a fearsome appearance, adorned with skulls and wearing a garland of snakes.",85.3245480917394,27.673131964888, Religious Site,Nepal
90,Bhat Bhateni Temple," Kathmandu Municipility ward no. 5 Bhatbhateni temple located near Tangal road. It is an ancient pagoda style temple. Inside the temple are yellow goddess Bhateni and red goddess Bhat. This temple is also called Nepal Devi. There is a belief that worshiping this temple will cure the diseases of children, ghosts, vampires etc. There are various other deities in this temple complex. This temple is very crowded with devotees on Saturdays and Tuesdays.",85.3310470841825,27.7195635035005, Religious Site,Nepal
91,Bishwonath Mandir,"Bishwonath Temple, also known as Vishwanath Temple, is a revered Hindu temple located in Lalitpur, Nepal. Lalitpur, also known as Patan, is one of the three ancient cities in the Kathmandu Valley, renowned for its rich cultural heritage and historical significance. Bishwonath Temple holds a prominent place among the numerous temples and monuments that dot the landscape of Lalitpur.

The temple is dedicated to Lord Shiva, one of the principal deities in Hinduism, who is worshipped as Bishwonath, the ""Lord of the Universe."" It is believed to have been built during the reign of King Siddhi Narsingh Malla in the 17th century, although the exact date of its construction is not precisely known.

The main sanctum of the temple houses a sacred Shiva Lingam, a symbolic representation of Lord Shiva, which is worshipped by devotees who visit the temple seeking blessings, protection, and spiritual fulfillment. The temple complex also includes smaller shrines dedicated to various Hindu deities, along with pavilions and courtyards where religious rituals and ceremonies take place.",85.325086209923,27.6736379228843, Religious Site,Nepal
92,Jalbinayak Mandir,jalbinayak mandir.,85.3164323978126,27.6792095783278, Religious Site,Nepal
93,Purnachandi Mandir,"Purnachandi Temple is located about 500 meters west of Patan's (Lalitpur's) Darbar Square. It is a tall, three-story pagoda standing at the south end of a small tear-drop shaped pond. While the temple was consecrated in 1635 during the reign of Siddhi Narasimha Malla (r. 1620-61), the present structure dates from the last quarter of the 17th century after the original monument was destroyed by fire.",85.3202300705016,27.6736912709977, Religious Site,Nepal
94,Krishna Mandir,"The Krishna temple on the west side of Patan's Darbar square was completed in 1637. Legend says that it was inspired by a dream. One night, King Siddhi Narasingh Malla (r. 1620-61) dreamt that the gods Krishna and Radha were standing in front of the palace. The King ordered a temple built on the same location. During a war with a neighboring kingdom a decade later, the King emerged victorious after calling on Krishna to vanquish his enemies. In gratitude, the King built a replica of the temple inside the Sundari Chauk courtyard.

The Krishna temple is built in the sikhara style common to north India and Bengal, a design technique found in monuments as far afield as Bagan, Myanmar. Beneath its 21 golden pinnacles are three floors. The first floor enshrines Krishna, the second Shiva (in the form of a linga), and the third Lokeshwor. Except for the ground floor, a series of chhatri pavilions frame the inner ambulatories; eight each are located at the corners and cardinal directions of the second and third levels, while the fourth level includes four ornamental chattri built directly into each face of the sikhara. On the ground floor, the inner walls of the wraparound gallery are divided into five bays on each side, with a door located at the center of each facade. The remaining bays feature scenes from the Ramayana and Mahabharata narrated in Newari script.

Krishna is believed to be an earthly incarnation of Vishnu; hence, images of Vishnu and his mount, Garuda, are found throughout the temple. Four full-size statues of Vishnu upon Garuda surround the base of the sikhara, while bas-reliefs of the same theme are located on the ground floor cornices. Depictions of the 10 avatars of Vishnu are also set on the outside face of the ground-level gallery. A freestanding statue of gided Garuda, mounted upon a pole, is set in front of the temple. It was erected by Siddhi Narasingh Malla about ten years after construction of the temple.",85.3249531053007,27.6735646199367, Religious Site,Nepal
95,Gunalakshmi Mahabihar,Newar Buddhism is one of the branches of Buddhism. One of the major elements of this branch of Buddhism is Mahavihara (????????) or Baha or great monastery. These monasteries have served as centers of learning in Newar Buddhism. These monasteries generally are built as a courtyard surrounded by two storied buildings consisting of halls. Some of these monasteries have been founded as early as fifth to twelfth century  Many of these mahaviharas are listed as historical monuments of Nepal.The following is a list of these mahaviharas.,85.3267589025199,27.6755129277546, Archaeological Site,Nepal
